{
  "$schema": "https://json-schema.org/draft/2020-12/schema",
  "$id": "https://github.com/onyb/gst/spec/section.schema.json",
  "title": "GST return section specification",
  "description": "Meta-schema for per-section spec files (spec/gstr1/*.json, spec/gstr3b/*.json). A section spec describes one table of a return: where its rows come from (Excel sheet / CSV), what each column means and must satisfy, cross-field rules, how rows group into records, and how records map onto the portal upload payload.",
  "type": "object",
  "additionalProperties": false,
  "required": ["section", "return", "title", "source", "fields", "grouping", "output"],

  "properties": {
    "$schema": {
      "description": "Relative path back to this meta-schema, so editors validate section specs as they are written.",
      "type": "string"
    },
    "section": {
      "description": "Section code as used by the official tooling (b2b, b2ba, cdnr, ...). Unique within a return.",
      "type": "string",
      "pattern": "^[a-z0-9_()]+$"
    },
    "return": {
      "description": "Return this section belongs to.",
      "enum": ["gstr1", "gstr3b"]
    },
    "title": {
      "description": "Human-readable section name, including the statutory table numbers it feeds.",
      "type": "string"
    },
    "provenance": {
      "description": "Which official artifact versions this spec was derived from. Lets a spec file be re-verified against a pinned release.",
      "type": "object",
      "additionalProperties": false,
      "properties": {
        "offline_tool": { "type": "string" },
        "excel_template": { "type": "string" },
        "csv_template": { "type": "string" },
        "verified_on": {
          "description": "ISO date the spec was last checked against the artifacts above.",
          "type": "string",
          "format": "date"
        }
      }
    },

    "source": {
      "description": "Where rows are read from. A section may be importable from an Excel sheet, a section CSV, or both.",
      "type": "object",
      "additionalProperties": false,
      "minProperties": 1,
      "properties": {
        "excel": {
          "type": "object",
          "additionalProperties": false,
          "required": ["sheet", "header_row", "first_data_row"],
          "properties": {
            "sheet": {
              "description": "Worksheet name, matched exactly (names contain commas, e.g. 'b2b,sez,de').",
              "type": "string"
            },
            "header_row": {
              "description": "1-based row holding the column headers.",
              "type": "integer",
              "minimum": 1
            },
            "first_data_row": {
              "description": "1-based row of the first data record. Error messages report this offset, so a 0-based record index i maps to sheet row i + first_data_row.",
              "type": "integer",
              "minimum": 1
            },
            "max_data_row": {
              "description": "Last row the official template's data validation covers, where one exists. Rows beyond it are outside the template's guarantees.",
              "type": "integer",
              "minimum": 1
            }
          }
        },
        "csv": {
          "type": "object",
          "additionalProperties": false,
          "required": ["file", "header_row"],
          "properties": {
            "file": {
              "description": "Filename in the official section-wise CSV set.",
              "type": "string"
            },
            "header_row": { "type": "integer", "minimum": 1 }
          }
        }
      }
    },

    "fields": {
      "description": "Column definitions in template order. `order` is the 0-based column position; both Excel and CSV use the same order unless a field overrides it.",
      "type": "array",
      "minItems": 1,
      "items": { "$ref": "#/$defs/field" }
    },

    "rules": {
      "description": "Cross-field rules, evaluated per row after field-level validation passes. Each is a `when` predicate (omitted = always) implying an `assert` predicate.",
      "type": "array",
      "items": { "$ref": "#/$defs/rule" }
    },

    "grouping": {
      "description": "How validated rows collapse into records. Sections are row-per-tax-rate: several rows sharing an invoice key become one invoice with several line items.",
      "type": "object",
      "additionalProperties": false,
      "properties": {
        "envelope_key": {
          "description": "Field ids that group invoices into an outer payload object (e.g. one object per recipient GSTIN). Absent for flat sections.",
          "type": "array",
          "items": { "type": "string" }
        },
        "invoice_key": {
          "description": "Field ids identifying one invoice/document within an envelope. Omitted by flat sections, which have no invoice level — every validated row becomes its own payload object.",
          "type": "array",
          "minItems": 1,
          "items": { "type": "string" }
        },
        "invoice_key_case_insensitive": {
          "description": "Whether invoice-key comparison folds case. The official tool lowercases document numbers before matching.",
          "type": "boolean",
          "default": false
        },
        "item_key": {
          "description": "Field ids identifying one line item within an invoice. Absent for sections with no item level.",
          "type": "array",
          "items": { "type": "string" }
        },
        "item_conflict": {
          "description": "What happens when two rows share both an invoice key and an item key. `last_wins`: the later row silently replaces the earlier one (no summing, no error).",
          "enum": ["last_wins", "sum", "error"]
        },
        "agree_fields": {
          "description": "Extra field ids that rows grouped together must agree on, beyond those the payload carries. Agreement and emission are separate concerns: the reference compares the recipient's name when matching rows to a note, yet strips that name before writing the upload file.",
          "type": "array",
          "items": { "type": "string" }
        },
        "invoice_field_conflict": {
          "description": "What happens when rows sharing an invoice key disagree on an invoice-level field. `error`: the whole invoice is rejected.",
          "enum": ["error", "first_wins"]
        }
      }
    },

    "output": {
      "description": "Mapping onto the portal upload payload. A section is either nested (`envelope` + `invoice`, optionally `item`) or flat (`record` alone): flat sections emit one object per validated row, with tax computed on the row itself rather than in a line item.",
      "type": "object",
      "additionalProperties": false,
      "anyOf": [
        { "required": ["record"] },
        { "required": ["invoice"] }
      ],
      "properties": {
        "record": {
          "description": "Flat sections only: maps one validated row to one payload object. Mutually exclusive with envelope/invoice/item.",
          "$ref": "#/$defs/payload_object"
        },
        "envelope": {
          "description": "Outer grouping object, e.g. one per recipient or place of supply. Omit it for a section whose records sit at the top level of the payload but still carry line items.",
          "$ref": "#/$defs/payload_object"
        },
        "invoice": { "$ref": "#/$defs/payload_object" },
        "item": { "$ref": "#/$defs/payload_object" },
        "derivations": {
          "description": "Named computations the engine implements, referenced by payload keys whose value is computed rather than mapped. Documented in `derivation_notes`.",
          "type": "array",
          "items": { "type": "string" }
        },
        "derivation_notes": {
          "description": "Prose + formula for each derivation named above, keyed by derivation name.",
          "type": "object",
          "additionalProperties": { "type": "string" }
        }
      }
    },

    "notes": {
      "description": "Free-form observations: quirks of the reference behavior, open questions, deliberate divergences.",
      "type": "array",
      "items": { "$ref": "#/$defs/note" }
    }
  },

  "$defs": {
    "field": {
      "type": "object",
      "additionalProperties": false,
      "required": ["id", "column", "order", "type", "required"],
      "properties": {
        "id": {
          "description": "Stable internal identifier, matching the portal payload key where one exists.",
          "type": "string",
          "pattern": "^[a-z][a-z0-9_]*$"
        },
        "column": {
          "description": "Column header text, matched exactly after trimming.",
          "type": "string"
        },
        "order": {
          "description": "0-based column position in the template.",
          "type": "integer",
          "minimum": 0
        },
        "type": {
          "description": "Value domain, independent of which values are allowed — restrict those with `enum` or `enum_ref`. `decimal` values are exact (never binary floating point) and are emitted as JSON numbers; `text` is emitted as a string. `state_code` is a 'NN-Name' cell reduced to its numeric prefix.",
          "enum": ["text", "decimal", "date", "gstin", "state_code"]
        },
        "required": {
          "description": "Whether the cell must be non-empty. A field with a `default` is satisfied when empty, by taking that default.",
          "type": "boolean"
        },
        "default": {
          "description": "Value substituted when the cell is empty, before validation."
        },
        "pattern": {
          "description": "Regular expression the raw cell text must match.",
          "type": "string",
          "format": "regex"
        },
        "accepts": {
          "description": "For `gstin` fields: which registration-number forms are accepted, most-specific first.",
          "type": "array",
          "items": { "enum": ["gstin", "uin", "tds", "nrtp", "eco"] }
        },
        "enum_ref": {
          "description": "Pointer to a masters file supplying the allowed values, as 'file#/json/pointer'.",
          "type": "string"
        },
        "enum": {
          "description": "Inline allowed values, when too small or too section-specific for a masters file.",
          "type": "array"
        },
        "round_to": {
          "description": "Decimal places this amount is rounded to BEFORE its pattern is checked, mirroring the reference's cnvt2Nm(). Set it on exactly those fields the reference wraps in that conversion: a value with more places is accepted and rounded rather than rejected, and the rounded value is what reaches the payload.",
          "type": "integer",
          "minimum": 0
        },
        "max_length": { "type": "integer", "minimum": 1 },
        "constraints": {
          "description": "Named field-level checks beyond pattern/enum, implemented by the engine. A bare string names a check that takes no parameters; the object form carries a parameter and/or limits the check to a range of return periods, so period-dependent rules keep their numbers in the spec rather than in code.",
          "type": "array",
          "items": {
            "oneOf": [
              { "type": "string" },
              {
                "type": "object",
                "additionalProperties": false,
                "required": ["name"],
                "properties": {
                  "name": { "type": "string" },
                  "value": {
                    "description": "Parameter for checks that compare against a number, e.g. a minimum.",
                    "type": "number"
                  },
                  "from_period": {
                    "description": "Applies only when the return period is this period or later (MMYYYY).",
                    "type": "string",
                    "pattern": "^(0[1-9]|1[0-2])[0-9]{4}$"
                  },
                  "until_period": {
                    "description": "Applies only when the return period is strictly earlier than this period (MMYYYY).",
                    "type": "string",
                    "pattern": "^(0[1-9]|1[0-2])[0-9]{4}$"
                  },
                  "description": { "type": "string" }
                }
              }
            ]
          }
        },
        "transform": {
          "description": "Named normalization applied to the accepted value before grouping and output.",
          "type": "string"
        },
        "must_be_empty": {
          "description": "The column exists in the template but no value is permitted for this section.",
          "type": "boolean"
        },
        "description": { "type": "string" }
      }
    },

    "rule": {
      "type": "object",
      "additionalProperties": false,
      "required": ["id", "assert", "message"],
      "properties": {
        "id": {
          "description": "Stable rule identifier, namespaced by section (e.g. 'b2b.cbw_requires_rchrg'). Referenced by error reports and tests.",
          "type": "string",
          "pattern": "^[a-z0-9_()]+\\.[a-z0-9_]+$"
        },
        "description": { "type": "string" },
        "when": {
          "description": "Guard predicate. Omitted means the assertion always applies.",
          "$ref": "#/$defs/predicate"
        },
        "assert": {
          "description": "Predicate that must hold when the guard does.",
          "$ref": "#/$defs/predicate"
        },
        "message": {
          "description": "Operator-facing message, phrased in template vocabulary (column headers, not field ids).",
          "type": "string"
        },
        "severity": {
          "enum": ["error", "warning"],
          "default": "error"
        }
      }
    },

    "predicate": {
      "description": "Boolean expression over a row's fields. Exactly one form per object: a leaf comparison on a single field, or a combinator over sub-predicates. Deliberately not an expression language — the engine walks this structure directly.",
      "type": "object",
      "additionalProperties": false,
      "minProperties": 1,
      "maxProperties": 2,
      "properties": {
        "field": {
          "description": "Field id under test. Required for leaf forms.",
          "type": "string"
        },
        "eq": { "description": "Field equals this value." },
        "ne": { "description": "Field does not equal this value." },
        "in": {
          "description": "Field is one of these values.",
          "type": "array"
        },
        "empty": {
          "description": "true: field is absent or blank. false: field has a value.",
          "type": "boolean"
        },
        "gte_field": {
          "description": "Field id this field must be numerically greater than or equal to. The only field-to-field comparison the language allows; a non-numeric side is treated as satisfied, since field-level validation already rejects it.",
          "type": "string"
        },
        "sign_agrees_with": {
          "description": "Field id whose sign this field must share: both positive, both negative, or either one zero. A non-numeric side is treated as satisfied, since field-level validation already rejects it.",
          "type": "string"
        },
        "all": {
          "description": "Conjunction.",
          "type": "array",
          "items": { "$ref": "#/$defs/predicate" }
        },
        "any": {
          "description": "Disjunction.",
          "type": "array",
          "items": { "$ref": "#/$defs/predicate" }
        },
        "not": { "$ref": "#/$defs/predicate" }
      },
      "oneOf": [
        { "required": ["field", "eq"] },
        { "required": ["field", "ne"] },
        { "required": ["field", "in"] },
        { "required": ["field", "empty"] },
        { "required": ["field", "gte_field"] },
        { "required": ["field", "sign_agrees_with"] },
        { "required": ["all"] },
        { "required": ["any"] },
        { "required": ["not"] }
      ]
    },

    "payload_object": {
      "description": "One level of the upload JSON. Keys are payload key names; values say where the content comes from.",
      "type": "object",
      "additionalProperties": false,
      "required": ["keys"],
      "properties": {
        "keys": {
          "type": "array",
          "minItems": 1,
          "items": {
            "type": "object",
            "additionalProperties": false,
            "required": ["key", "from"],
            "properties": {
              "key": {
                "description": "Key name in the upload JSON.",
                "type": "string"
              },
              "from": {
                "description": "`field:<id>` maps a field; `derive:<name>` computes it; `nested:<level>` embeds the level below.",
                "type": "string",
                "pattern": "^(field:[a-z][a-z0-9_]*|derive:[a-z0-9_.]+|nested:(invoice|item))$"
              },
              "omit_when_empty": {
                "description": "Key is left out entirely rather than emitted as null or empty string.",
                "type": "boolean",
                "default": false
              },
              "omit_when_value": {
                "description": "Key is left out when it would carry exactly this value. Covers keys the reference drops at a default rather than at empty."
              },
              "only_when_value": {
                "description": "Key is emitted ONLY when it carries exactly this value, and dropped for anything else. The reference keeps the tax-rate factor solely when it is 0.65, discarding every other value rather than just the default."
              },
              "verify": {
                "description": "Marks a key whose presence or exact form is not yet confirmed. `oracle`: must be settled by differential capture against the official tool before this section is trusted.",
                "enum": ["oracle"]
              },
              "description": { "type": "string" }
            }
          }
        }
      }
    },

    "note": {
      "type": "object",
      "additionalProperties": false,
      "required": ["kind", "text"],
      "properties": {
        "kind": {
          "description": "`quirk`: reference behavior that is surprising but reproduced deliberately. `open_question`: unresolved, needs oracle capture. `divergence`: where this implementation intentionally differs.",
          "enum": ["quirk", "open_question", "divergence"]
        },
        "text": { "type": "string" },
        "affects": {
          "description": "Field ids, rule ids, or payload keys this note concerns.",
          "type": "array",
          "items": { "type": "string" }
        }
      }
    }
  }
}
